name,physical_address,location,website
Mackerel Scuba,"Near SBI Banic Govind, Nagar, No 2, Swarajdeep, Havelock, Port Blair 744211, No State, India","Havelock, Port Blair, India",https://www.padi.com/dive-center/india/mackerel-scuba/
Indigo Divers,"25 North West Point Road, West Bay, No State KY1-1202, Cayman Islands","Grand Cayman, Cayman Islands",http://www.indigodivers.com
High Waves,"Al Raha Beach Resort, No State, United Arab Emirates","Abu Dhabi, United Arab Emirates",http://www.highwaveswatersports.com
Adventure Diving,"3113 Highway 421, Bristol, Tennessee 37620, United States","Bristol, United States of America (USA)",http://www.adventurediving.com
Pacific Rim Divers Limited,"Honokohau Marina, Kealakehe Parkway, Kailua-Kona, Hawaii, Hawaii 96740, United States","Kailua-Kona, Hawaii, United States of America (USA)",http://www.pacificrimdivers.com
Scuba Luv Maui,"2960 S. Kihei Rd, Kihei, Maui, Hawaii 96753, United States","Kihei, Maui, United States of America (USA)",http://www.scubaluvmaui.com
Pearl Dimaniyat Diving Center,"Seeb Marina, Seeb/Muscat, Oman","Seeb/Muscat, Oman",http://www.pearldimaniyat.com
Emerald Sea Diving,"9011 SW Beaverton Hillsdale Highway, Suite 1C, Portland, Oregon 97225, United States","Portland, United States of America (USA)",http://www.emeraldseadiving.com
Atlantida Diving School,"Bragado, Capital Federal, 5950 Buenos Aires, No State, Argentina","Buenos Aires, Argentina",http://www.divingschool.com.ar
Jamanta Dive Center,"Av. Vereador Benedito Adelino, 1421, Bonfim, Angra dos Reis-Rio de Janeiro, 23909-070, Brazil","Angra dos Reis, Brazil",https://www.pousadajamanta.com.br
Sealion Dive Center,"Calle Gaviotas #7, Sector CETMAR, 81370 Topolobampo, Sinaloa, Mexico","Topolobampo, Mexico",http://www.sealiondivecenter.com
AQUAVIT IZUOSHIMA,"〒100-0101, Tokyo - 東京都, 1-92 AZA KITANO, MOTOMACHI OSHINACHO, Japan, 〒100-0101, Tokyo - 東京都, 東京都大島町元町字北野1-92, Japan","TOKYO, Japan",http://www.aquavit-web.com
Dive Zultha,"Jalan Raja Senggigi, km8 no 15 Kec. Batu Layar, Lombok, No State 83355, Indonesia","Lombok, Indonesia",https://youtu.be/LnzwoqUhxnE?si=qwRnPpVfu9yKJnfV
Dive Union,"Kahuna Beach Resort and Spa, National Highway, Brgy Urbiztondo, San Juan,, , La Union, 2514 No State, Philippines","La Union, Philippines",http://diveunion.com.ph/
Kaiwai Watersports at Fiji Marriott Resort,"Fiji Marriott Resort Momi Bay, Savusavu Road, Momi Bay, Nadi, Fiji","Momi Bay, Nadi, Fiji",https://kaiwaifiji.com/
Eco Dive School Cabo Verde,"C.P. 182, Santa Maria, Sal, No State, Cape Verde","Santa Maria, Sal, Cape Verde",http://www.ecodiveschool.com
Matangi Private Island Resort,"Matangi Island, Fiji, Fiji","Fiji, Fiji",http://www.matangiisland.com
BLUE LIFE,"〒649-2211, Wakayama - 和歌山県, 1332-13 Shirahamacho, Nishimurogun, Japan, 〒649-2211, Wakayama - å’Œæ­Œå±±çœŒ, 和歌山県西牟婁郡白浜町1332-13 赤澤ビル1F, Japan","Wakayama, Japan",https://www.diving-bluelife.com/
EACY Dive School,"Tamaraw Beach Resort, Aninuan Beach, Oriental Mindoro, , Puerto Galera, 5203 No State, Philippines","Puerto Galera, Philippines",http://www.eacydive.org
Dua Dua Beach Resort,"Volivoli Road, Volivoli, Rakivala, Fiji","Rakivala, Fiji",http://www.duaduaresort.com
"Port Divers, Inc.","811 Hallock Avenue, Port Jefferson Station, New York 11776, United States","Port Jefferson Station, United States of America (USA)",http://www.portdiver.com
Sirenas Adventures,"From Maxi Pali, 2 Blocks South and 2 blocks, East, Playa Coco, Sardinal, Carrillo, No State, Guanacaste, 50503, Costa Rica","Guanacaste, Costa Rica",http://www.sirenasdivingcostarica.com
Tag and Travel Sdn Bhd,"Lot 4, Block 4 SNO215, Kawasan Bandar Kedai, 91308 Semporna, Sabah, No State, Malaysia","Semporna, Sabah, Malaysia",https://www.padi.com/dive-center/malaysia/tag-and-travel-sdn-bhd/
Blue'n BLUE,"〒801-0808, Fukuoka - 福岡県, 1-1-4 KUZUHA MOJIKU, KITAKYUSHYUSHI, Japan, 〒801-0808, Fukuoka - 福岡県, 福岡県北九州市門司区葛葉1-1-4, Japan","FUKUOKA, Japan",https://www.blue-n-blue.com
XIX Diving,"No State, Hong Kong, Unit A, 2/F, Ko's House, 38 Dundas Street, Mong Kok, Kowloon, Hong Kong","Hong Kong, zzzz",https://www.facebook.com/xixdiving/
Khmer Dive Club,"A10, Street 4,, Sangkat Toul Sangke, Phnom Penh 0, Cambodia","Phnom Penh, Cambodia",https://www.khmerdivegroup.com/
Bali Elite Scuba,"Jl. Singaraya - Amlapura, Tulamben - Kubu Karangasem, Bali, Amed, No State 80853, Indonesia","Amed, Indonesia",https://www.tulambenscubadiving.com/
Ohlala Divers,"Lot 15, Longbeach, Pulen, Perhentian, Kuala Besut, 22300 Terengganu, No State, Malaysia","Terengganu, Malaysia",http://www.ohlalaperhentian.com
Shimoda Mikomoto Divers,"〒415-0152, Shizuoka - 静岡県, 233-1 MINATO, MINAMIIZUCHO KAMOGUN, Japan, 〒415-0152, Shizuoka - 静岡県, 静岡県賀茂郡南伊豆町湊233-1, Japan","SHIZUOKA, Japan",http://www.shimodadivers.com/
Cozumel Divers,"Carretera Costera Sur Km 6.5, Marina Asipana, 77675 Cozumel, Quintana Roo, Mexico","Cozumel, Mexico",http://www.cozumeldivers.com
Diving Shop & School fluffy,"〒561-0881, Osaka - 大阪府, 4-14-2 Nakasakurazuka, Toyonakashi, Japan, 〒561-0881, Osaka - å¤§é˜ªåºœ, 大阪府豊中市中桜塚4-14-2, Japan","Osaka, Japan",https://www.fluffy-dive.jp
Espace Mer,"1 Chemin du Bouvet, 83400 Hyeres, France","Hyeres, France",http://www.espacemer.fr
Orca Diving Academy,"#3, Bowwood Road, Claremont, Western Cape, Cape Town, 7708, South Africa","Cape Town, South Africa",http://www.orca-industries.co.za
Whale Apnea Dive Center Sdn. Bhd,"Lot 38, Block G, Semporna Township Seafront Resort, 91308 Semporna, Sabah, No State, Malaysia","Semporna, Sabah, Malaysia",https://www.douyin.com/user/MS4wLjABAAAA7WJFVMcabIB6jmDRaMBZontL_c08rgU5iHWDGFVBKfinDbSmXsCnWezzOaDn3btJ
Scuba Daze Belize,"4.5 Miles North, Ambergris, Caye, Belize","Ambergris, Caye, Belize",http://www.scubadazebelize.com
East Bay Dive Center,"8 Church Street, Warren, Rhode Island 02885, United States","Warren, United States of America (USA)",http://www.eastbaydivecenter.com/
Institute for Marine Research,,"Negros Oriental, Philippines",
Tauchschule Divecrew Berlin,"Inh. Christian Markmann, Reuterstr. 31, 12047 Berlin, Germany","Berlin, Germany",http://www.divecrew-berlin.de
Crema Diving,"Piazza Garibaldi 57, 26013 Crema (cremona) No State, Italy","Crema (cremona), Italy",http://www.cremadiving.it
Ted's Scuba,"3133 Eastbrook Volant Road, Volant, Pennsylvania 16066, United States","Volant, United States of America (USA)",http://www.tedsscuba.com
Delightful Divers,"107 Robin Road, Saint Marys, Pennsylvania 15857, United States","Saint Marys, United States of America (USA)",http://www.delightfuldivers.com
"Aquatic Escapes Dive Center, LLC","2 Mercury Drive, Londonderry, New Hampshire 03053, United States","Londonderry, United States of America (USA)",http://www.aquaticescapes.com
S10 DIVING CENTER,"100000, Shanghai Municipality - 上海市 Shànghǎi ShìShanghai, Jiangyang nanlu was #485, 2#-108, China","Shanghai, China",https://www.divecenter.cn/
ScubaJuan,"Av Rafael E Melgar 628, 77600 Centro Cozumel, Quintana Roo, Mexico","Centro Cozumel, Mexico",http://www.scubajuan.com
Living in the Flow Diving,"200 Nohea Kai Drive, Lahaina, Maui, Hawaii 97671, United States","Lahaina, Maui, United States of America (USA)",http://livingintheflow.net
Adventure Diving,"3113 Highway 421, Bristol, Tennessee 37620, United States","Bristol, United States of America (USA)",http://www.adventurediving.com
Blue Fin Dive Center,"Bahnhofstr. 23, 67596 Dittelsheim, Germany","Dittelsheim, Germany",https://www.bluefindivecenter.de
Ta'a Dive Resort,"Ta'sktana, A Luxury Collection Resort & Spa, Jl Wae Cicu Labuan Bajo, Kec. Komodo, Kab Manggara, Komodo, No State 86763, Indonesia","Komodo, Indonesia",https://www.marriott.com/en-us/hotels/lbjlc-taaktana-a-luxury-collection-resort-and-spa-labuan-bajo/overview/
DIVING STATION KANCHI,"〒906-0006, Okinawa - 沖縄県, 2-5 NISHINAKASONE, HIRARA MIYAKOJIMASHI, Japan, 〒906-0006, Okinawa - 沖縄県, 沖縄県宮古島市平良字西仲宗根2-5, Japan","OKINAWA, Japan",https://www.kanchi32.com
Divers Den,"5454 South Highway 27, Suite 1, Somerset, Kentucky 42501, United States","Somerset, United States of America (USA)",https://www.facebook.com/diversden1
ArchiMete - Diving Capo Caccia,"Via Delle Prigionette 52, 07041 Alghero-Capo Caccia No State, Italy","Alghero-Capo Caccia, Italy",http://www.archimete.it
Oceanic Expeditions Belize Limited,"2 Miles North Ambergris Caye, San Pedro, Belize","San Pedro, Belize",https://www.oceanictoursbelize.com/
True North Adventure Cruises,"Carnarvon Street, Broome Western Australia 6725, Australia","Broome, Australia",https://truenorth.com.au
Tabuk Divers,"Al-Jadah Street, beside Al Arabi Bank (Tely Money), Tabuk 31411, Saudi Arabia","Tabuk, Saudi Arabia",http://tabukdivers.com
Wanderers,"B-12 Chichirica street, Tumon, Guam 96931, United States","Tumon, United States of America (USA)",http://www.s2club.net/guam/
Tomlin Dive Shop,"1269 4e Rue, Val-d’Or Quebec J9P 4A8, Canada","Val-d’Or, Canada",http://www.tomlindiveshop.com
Manta Diving Base,"430000, Hubei Province - 湖北省 Húběi ShěngWuhan, No. 6-106, building 6, huachenghui, Huacheng Avenu, 武汉花城大道花城汇6栋6-106号, China","Wuhan, China",https://mp.weixin.qq.com/s/s1Xo9CPdFgPO3smU27S_-A
Ta'a Dive Resort,"Ta'sktana, A Luxury Collection Resort & Spa, Jl Wae Cicu Labuan Bajo, Kec. Komodo, Kab Manggara, Komodo, No State 86763, Indonesia","Komodo, Indonesia",https://www.marriott.com/en-us/hotels/lbjlc-taaktana-a-luxury-collection-resort-and-spa-labuan-bajo/overview/
Scuba with Alison,"FONATUR Marina, Costera Sur Km. 6.5m Hotelera Sur, 77675 Cozumel, Quintana Roo, Mexico","Cozumel, Mexico",http://www.scubawithalison.com
New Sambo Safari Boat,"Quesseir City HQ, Red Sea, No State, 84728, Egypt","Red Sea, Egypt",http://www.sambodivers.com
E. Ragnole,"12 cours Lucien Bonaparte, 20000 Ajaccio, France","Ajaccio, France",http://www.eragnole.com/
Acqua World,"Rua Jorge Veiga, 310 Loja 07, Gamboa, Cabo Frio-Rio de Janeiro, 28922-030, Brazil","Cabo Frio, Brazil",http://www.acquaworld.com.br
Tag and Travel Sdn Bhd,"Lot 4, Block 4 SNO215, Kawasan Bandar Kedai, 91308 Semporna, Sabah, No State, Malaysia","Semporna, Sabah, Malaysia",https://www.padi.com/dive-center/malaysia/tag-and-travel-sdn-bhd/
Freeway Niigata,"〒950-0941, Niigata - 新潟県, 5-2-10 MEIKE CHUOKU, NIGATASHI, Japan, 〒950-0941, Niigata - 新潟県, 新潟県新潟市中央区女池5-2-10, Japan","NIIGATA, Japan",http://niigata-freeway.jimdo.com/
Sail Ningaloo Pty Ltd,"1 Robinson Street, Coral Bay Western Australia 6701, Australia","Coral Bay, Australia",http://www.sailningaloo.com.au
Blue Marine Services,"104 Koktanot Road, Karon, Muang, Phuket, No State 83100, Thailand","Phuket, Thailand",https://bluemarine-divers.com
Passkey Dive Station,"〒010-0803, Akita - 秋田県, 3-16-13 SOTOASAHIKAWA, YATSUYANAGI AKITASHI, Japan, 〒010-0803, Akita - 秋田県, 秋田県秋田市外旭川八柳3-16-13, Japan","AKITA, Japan",https://passkeydivestation.com/
"Port Divers, Inc.","811 Hallock Avenue, Port Jefferson Station, New York 11776, United States","Port Jefferson Station, United States of America (USA)",http://www.portdiver.com
Civil Defence Training Academy,"ALPHA, 14617 Persiaraan Insititusi Bangi, 43000 Kajang, No State, Malaysia","Kajang, Malaysia",https://NotApplicable.com
Hollywoodivers,"3575 Cahuenga Blvd West 104, Los Angeles, California 90068, United States","Los Angeles, United States of America (USA)",http://www.hollywooddivers.com
Diving Shop Liberty,"〒210-0023, Kanagawa - 神奈川県, #202 15-2 OGAWACHO KAWASAKIKU, KAWASAKISHI, Japan, 〒210-0023, Kanagawa - ç¥žå¥ˆå·çœŒ, 神奈川県川崎市川崎区小川町15-2 濱屋ビル2F-202, Japan","KANAGAWA, Japan",https://diving-liberty.com/
Maldives Boat Club,"M. Narugsmaage-Age, Alhivila Magu, Male 20292, Maldives","Male, Maldives",http://www.maldivesboatclub.com
Blue Hole Dive Center,"946, No StatePingtung, No. 128-12, Daguang Rd.,, Hengchun Township, Pingtung, Taiwan","Pingtung, Taiwan",https://www.blueholedive2015.com/
Semporna Smart Tours Sdn Bhd,"Lot 9, Jetty Pelancongan Kg Bangau Bangau, 91300 Semporna, Sabah, No State, Malaysia","Semporna, Sabah, Malaysia",https://www.facebook.com/profile.php?id=100057559354976
Blue Marlin,"PO Box 669, Koror, Palau 96940, United States","Koror, United States of America (USA)",https://bluemarlinpalau.com/
Wanderers,"B-12 Chichirica street, Tumon, Guam 96931, United States","Tumon, United States of America (USA)",http://www.s2club.net/guam/
Dive Shop Seasound,"〒100-0211, Tokyo - 東京都, 1026-15 SASHIKIJIOKINONE, OSHIMACHO, Japan, 〒100-0211, Tokyo - 東京都, 東京都大島町差木地字沖の根1026-15, Japan","TOKYO, Japan",https://www.seasound.jp/
Aqua Mundo,"Costera Miguel Aleman 100, Muelle Paseo Del Pescador, Col Centro, 39300 Acapulco, Guerrero, Mexico","Acapulco, Mexico",http://www.aquamundoaca.com
Snuba Key West,"3218 North Roosevelt Boulevard, Key West, Florida 33040, United States","Key West, United States of America (USA)",http://www.divemasterkeywest.com
Drake Divers,"Calle Hacia Los Planes, Contiguo Al Bar La Tureka, Rest Sade Mar, No State, Bahia Drake, Puntarenas, 60503, Costa Rica","Bahia Drake, Puntarenas, Costa Rica",http://www.drakediverscr.com
Awesome Dive,"Purok 7, Alona Beach, Tawala Panglao, , Bohol, 6340 No State, Philippines","Bohol, Philippines",http://awesomedive.mystrikingly.com
Lecques Aquanaut Center,"Nouveau Port des Lecques, 83270 Saint Cyr sur Mer, France","Saint Cyr sur Mer, France",http://www.lecques-aquanaut.fr
Lizard Island Lodge,"Lizard Island Resort, Lizard Island Queensland 4870, Australia","Lizard Island, Australia",http://www.lizardisland.com.au/?gclid=COz1mbq4msQCFUaXvQodGq8Ahg
Divevora Sri Lanka,"Galle Road, Peraliya, Hikkaduwa, 80244, Sri Lanka","Hikkaduwa, Sri Lanka",http://divevora.com
Tatsukushi Diving Center,"〒787-0452, Kochi - 高知県, 3897 TATSUKUSHI, TOSASHIMIZUSHI, Japan, 〒787-0452, Kochi - 高知県, 高知県土佐清水市竜串3897, Japan","KOCHI, Japan",https://www.tdc2001.com
Tears Blue Diving,"〒100-0601, Tokyo - 東京都, 668-2, KOUZUSHIMAMURA, Japan, 〒100-0601, Tokyo - 東京都, 東京都神津島村668-2, Japan","TOKYO, Japan",http://tearsblue.jp
Mabuhay Thresher Dive Resort,"Bounty Beach, Logon, Baan Bantayan, , Cebu, 6013 No State, Philippines","Cebu, Philippines",http://www.mabuhaythresher.com
Clube Do Mergulho,"Rua Prefeito Joaquim, Pessoa Passos 336, Bessa, Joao Pessoa-Paraiba, 58035-460, Brazil","Joao Pessoa, Brazil",https://travel.padi.com/it/centro-sub/preview/clube-do-mergulho/
Scuba Zoo,"5576 Holton Road (m120), Twin Lake, Michigan 49457, United States","Twin Lake, United States of America (USA)",http://www.scubazoo.net
Dive Tolo,"Sekeri 67, 21056 Tolo, Greece","Tolo, Greece",http://www.divetolo.com
Rude Dyk,"Vestergade 11, 7400 Herning, Denmark","Herning, Denmark",http://www.rudedyk.com
Hello Dive,"Jalan Mutiara, Kampung Ujung, (Samping Orange Hotel, Komodo, NTT, No State 86754, Indonesia","Komodo, NTT, Indonesia",https://hellodivekomodo.diversdesk.com
Operation Wallacea,"Hope House, Old Bolingbroke, Nr. Spilsby, Lincs., PE23 4EX, United Kingdom","Nr. Spilsby, Lincs., United Kingdom",http://www.opwall.com
Dive Studio Easy,"〒550-0013, Osaka - 大阪府, 1-19-3-3F SHINMACHI NISHIKU, OSAKASHI, Japan, 〒550-0013, Osaka - 大阪府, 大阪府大阪市西区新町1-19-3 サンライズ新町ビル3F, Japan","OSAKA, Japan",https://dive-studio-easy.com
Somer Dive,"JLN. Soekarno Hatta, Labuan Bajo, Flores, NTT, Komodo, No State 86554, Indonesia","Komodo, Indonesia",https://somerkomodo.com/
Lake Superior Divers Supply,"3028 West 3rd Street, Duluth, Minnesota 55806, United States","Duluth, United States of America (USA)",http://www.lakesuperiordiverssupply
Eco Dive School Cabo Verde,"C.P. 182, Santa Maria, Sal, No State, Cape Verde","Santa Maria, Sal, Cape Verde",http://www.ecodiveschool.com
Tears Blue Diving,"〒100-0601, Tokyo - 東京都, 668-2, KOUZUSHIMAMURA, Japan, 〒100-0601, Tokyo - 東京都, 東京都神津島村668-2, Japan","TOKYO, Japan",http://tearsblue.jp
Aqua Dive Paradise,"Jl. Puri Madha No.2, Tulamben, Kubu, Kabupaten Karangasem, Tulamben, No State 80853, Indonesia","Tulamben, Indonesia",http://www.tulambendivers.com
The Travel Connection & Scubaventures,"2478 F Road, Suite 9, Grand Junction, Colorado 81505, United States","Grand Junction, United States of America (USA)",https://scubaventuresgj.com/
Diveasy,"Bp 1001, 98730 Bora Bora No State, French Polynesia","Bora Bora, French Polynesia",http://www.diveasyborabora.com
Rucker Park,"1, Shanghai Municipality - 上海市 Shànghǎi ShìShanghai, 青浦区华新镇凤阁路55号, 凤起汇商场三楼308, China","Shanghai, China",https://mp.weixin.qq.com/s/U20d4VKlaNBvkrktmi-30w
Dyk i Gävle,"Ringvägen 13, SE-81841 Forsbacka, Sweden","Forsbacka, Sweden",http://dykigavle.se
Solomons Master,"Attn: Solomons Master, PO Box R28, Honiara, Guadalcanal, Solomon Islands","Guadalcanal, Solomon Islands",https://masterliveaboards.com/boats/solomons-master/
Dive Shop Seasound,"〒100-0211, Tokyo - 東京都, 1026-15 SASHIKIJIOKINONE, OSHIMACHO, Japan, 〒100-0211, Tokyo - 東京都, 東京都大島町差木地字沖の根1026-15, Japan","TOKYO, Japan",https://www.seasound.jp/
Drake Divers,"Calle Hacia Los Planes, Contiguo Al Bar La Tureka, Rest Sade Mar, No State, Bahia Drake, Puntarenas, 60503, Costa Rica","Bahia Drake, Puntarenas, Costa Rica",http://www.drakediverscr.com
The Remote Resort,"Nukuni Bay, Vanua Levu, Fiji","Vanua Levu, Fiji",https://theremoteresort.com
Safety Stop Scuba,"8209 Jefferies Highway, Walterboro, South Carolina 29488, United States","Walterboro, United States of America (USA)",http://www.safetystopscubasc.org
Scuba Factory Bali,"Jln Danau Poso No 159, Sanur, Denpasar, Bali, No State 80228, Indonesia","Bali, Indonesia",http://www.scubafactorybali.com/
Esprit de la Plongée,"L'Esprit de la Plongée SARL, Piscine du Parc, Promenade du Général Guisan 11, CH-1110 Morges, Switzerland","Morges, Switzerland",http://www.espritdelaplongee.ch
Scuba Spirit,"NH 66, Mavalli 1, Murdeshwar 581350, No State, India","Murdeshwar, India",http://www.scubaspirit.in
Scuba Zoo,"5576 Holton Road (m120), Twin Lake, Michigan 49457, United States","Twin Lake, United States of America (USA)",http://www.scubazoo.net
Crown Divers,"〒100-1401, Tokyo - 東京都, 311-2 Okago Hachijomachi, Hachijojima, Japan, 〒100-1401, Tokyo - 東京都, 東京都八丈島八丈町大賀郷311-2, Japan","Tokyo, Japan",https://crowndivers.com/
Divers Direct Fort Lauderdale,"180 Gulf Stream Way, Dania Beach, Florida 33004, United States","Dania Beach, United States of America (USA)",http://www.diversdirect.com
Aggressor Adventures,"C/O Aggressor Liveaboards, 209 Hudson Trace, Augusta, Georgia 30907, United States","Augusta, United States of America (USA)",http://www.aggressor.com
Riverside Scuba,"1043 West La Cadena Drive, Riverside, California 92501-1413, United States","Riverside, United States of America (USA)",http://riversidescuba.com
CC JOY DIVE,"130000, Jilin Province - 吉林省 Jílín ShěngChangchun, 朝阳区南湖大路56号力胜会馆内, Inside Lisheng Guild Hall, No. 56 Nanhu Road, Chao, China","Changchun, China",https://mp.weixin.qq.com/s/tJKrciIwGCSftVVj--uyug
Aruba Bob Snorkel & Scuba,"Savaneta 305, Saveneta, Aruba","Saveneta, Aruba",http://www.arubabob.com
Diveasy,"Bp 1001, 98730 Bora Bora No State, French Polynesia","Bora Bora, French Polynesia",http://www.diveasyborabora.com
Kent Scuba Ltd,"Kingsmead Leisure Centre, Kinsmead Road, Canterbury, CT2 7PH, United Kingdom","Canterbury, United Kingdom",http://www.kentscuba.com
Freeway Niigata,"〒950-0941, Niigata - 新潟県, 5-2-10 MEIKE CHUOKU, NIGATASHI, Japan, 〒950-0941, Niigata - 新潟県, 新潟県新潟市中央区女池5-2-10, Japan","NIIGATA, Japan",http://niigata-freeway.jimdo.com/
Indigo Divers,"25 North West Point Road, West Bay, No State KY1-1202, Cayman Islands","Grand Cayman, Cayman Islands",http://www.indigodivers.com
Dive Base 37,"〒939-0703, Toyama - 富山県, 3274-1 MIYAZAKI ASAHIMACHI, SHIMONIIKAWAGUN, Japan, 〒939-0703, Toyama - å¯Œå±±çœŒ, 富山県下新川郡朝日町宮崎3274-1, Japan","TOYAMA, Japan",https://divebase37.com
Chimney Rock Charters,"1 Harbour Street, Queenscliff Victoria 3226, Australia","Queenscliff, Australia",https://secure.netbookings.com.au/tourism/1829/viewtours
Misool Resort,"PT. Misool Eco Resort, Gedung Wanane,, Jl. Puncak Arfak No.8 Kampung Baru RT 02 / RW 03,, Kota Sorong, Papua Barat, No State 98413, Indonesia","Kota Sorong, Papua Barat, Indonesia",https://www.misool.info
Acapulco Scuba Center,"Club Nautico La Marina Acapulco, Costera Miguel Aleman 215, Las Playas, 39390 Acapulco, Guerrero, Mexico","Acapulco, Mexico",http://www.acapulcoscuba.com
Duck's Dive Center,"Kairaba Aqua Mondo Resort, Kilo 8 - Tourism Sector, Port Safaga, Red Sea, No State, Egypt","Port Safaga, Red Sea, Egypt",http://www.ducks-diving.com
Utama Villa Tulamben,"Jalan Pura Puseh, Tulamben, Tulamben, No State 80853, Indonesia","Tulamben, Indonesia",http://www.utamavillatulamben.com
Bellsub,"Av. Anchieta 1235 Jd Esplanada, Sao Jose Dos Campos-Sao Paulo, 12242-280, Brazil","Sao Jose Dos Campos, Brazil",http://www.bellsub.com.br
Seal Swim Australia & Montague Island Discovery To,"1 Bluewater Drive, Narooma New South Wales 2546, Australia","Narooma, Australia",http://www.sealswimaustralia.com.au
Dive & Dwell,"Br Dinas Tulamben, Desa Tulamben, Kecamatan Kubu, Kabupaten, Karangasem, Bali, No State 80853, Indonesia","Bali, Indonesia",https://mp.weixin.qq.com/s/oLjHxZLLaj3UW0cT3YNgpA
Honolulu Scuba Company,,"Honolulu, Oahu, United States of America (USA)",
DIVING SCHOOL I-FISH,"〒631-0012, Nara - 奈良県, 1546-6 NAKAYAMACHO, NARASHI, Japan, 〒631-0012, Nara - 奈良県, 奈良県奈良市中山町1546-6, Japan","NARA, Japan",https://love-diving.com
Aloha Scuba Diving Company,"1651 Ala Moana Boulevard, Slip 70, Honolulu, Hawaii 96815, United States","Honolulu, United States of America (USA)",http://www.divealohascuba.com
Liquid Cosmos Divers,"61-3638 Kawaihae Road, Kawaihae, Hawaii 96743, United States","Kawaihae, United States of America (USA)",https://www.liquidcosmosdivers.com
Manta Diving Base,"430000, Hubei Province - 湖北省 Húběi ShěngWuhan, No. 6-106, building 6, huachenghui, Huacheng Avenu, 武汉花城大道花城汇6栋6-106号, China","Wuhan, China",https://mp.weixin.qq.com/s/s1Xo9CPdFgPO3smU27S_-A
AAS Blau Mari,"Carrer de Sant Lluís, 12, 08940 Cornellà de Llobregat No State, Spain","Cornellà de Llobregat, Spain",http://www.blaumari.cat
G Fish Watersports Barbados,"Barbados Cruising Club, Aquatic Gap, Bridgetown, No State BR1 4038, Barbados","Bridgetown, Barbados",http://www.gfishbarbados.com
Lankayan Island Dive Resort,"1 Floor, Lot 37, Block C, Bandar Tyng, Mile 5 North Rd, PPM 255 Elopura, Sabah, 90000 Sandakan, No State, Malaysia","Sandakan, Malaysia",http://www.lankayan-island.com/
Scuba with Alison,"FONATUR Marina, Costera Sur Km. 6.5m Hotelera Sur, 77675 Cozumel, Quintana Roo, Mexico","Cozumel, Mexico",http://www.scubawithalison.com
Duck's Dive Center,"Kairaba Aqua Mondo Resort, Kilo 8 - Tourism Sector, Port Safaga, Red Sea, No State, Egypt","Port Safaga, Red Sea, Egypt",http://www.ducks-diving.com
CC JOY DIVE,"130000, Jilin Province - 吉林省 Jílín ShěngChangchun, 朝阳区南湖大路56号力胜会馆内, Inside Lisheng Guild Hall, No. 56 Nanhu Road, Chao, China","Changchun, China",https://mp.weixin.qq.com/s/tJKrciIwGCSftVVj--uyug
East Coast Divers,"213 Boylston Street, Brookline, Massachusetts 02445, United States","Brookline, United States of America (USA)",http://www.ecdivers.com
Duikvereniging Leeuwarden,"Jelsumerstraat 12, 8917 EN Leeuwarden, Netherlands","Leeuwarden, Netherlands",http://www.duikverenigingleeuwarden.nl
Superior Diving Services,"137 Gore Street, Sault Sainte Marie Ontario P6A 1L9, Canada","Sault Sainte Marie, Canada",https://www.padi.com/dive-center/canada/superior-diving-services/
Seahorse Diver SDN BHD,"Long Beach, Pulau Perhentian Kecil, Kuala Besut, Terengganu, 22300 Perhentian, No State, Malaysia","Perhentian, Malaysia",http://www.seahorsediver.com
Bliss Dive,"11 Triq Lx-Xaghra, Marsalforn, Gozo MFN 1142, Malta","Gozo, Malta",https://www.blissdive.com
Nærøy Dykk,"Fikkan, 7944 Indre Nærøy, Norway","Indre Nærøy, Norway",http://www.ndive.no/
Diventures Marietta,"2714 Sandy Plains Road, Marietta, Georgia 30066, United States","Marietta, United States of America (USA)",https://www.diventures.com/locations/marietta/
Kaiwai Watersports at Six Senses Resort,"Six Senses Fiji, Malolo Island, Vunabaka, Fiji","Vunabaka, Fiji",https://kaiwaifiji.com/
Suka Dive Club,"3B, Doyen Habitat, Srinagar Colony, Hyderabad 500073, No State, India","Hyderabad, India",https://sukadiveclub.lovable.app/
"Scuba Adventures for Everyone, LLC","13311 SW Kleier Drive, Hillsboro, Oregon 97123, United States","Hillsboro, United States of America (USA)",http://www.safescuba.net
Blue Deep Diving Center,"Mama's Coral Beach Hotel, Galle Road, Hikkaduwa, Sri Lanka","Hikkaduwa, Sri Lanka",http://www.bluedeepdiving.com
"Undersea Divers, Inc.","67 High Street, Unit 11, Danvers, Massachusetts 01923, United States","Danvers, United States of America (USA)",http://www.underseadivers.com
Matangi Private Island Resort,"Matangi Island, Fiji, Fiji","Fiji, Fiji",http://www.matangiisland.com
Diveasy,"Bp 1001, 98730 Bora Bora No State, French Polynesia","Bora Bora, French Polynesia",http://www.diveasyborabora.com
KoroSun Dive,"Hibiscus Highway, Savasi Island Resort, Savusavu, Fiji","Savusavu, Fiji",https://www.korosundive.com
