name,physical_address,location,website
Aqua Scuba School Liverpool,"12 Columbus Way, Bridge Road, Liverpool, L21 2QG, United Kingdom","Liverpool, United Kingdom",http://www.aquascubaschoolliverpool.co.uk
Aqua Scuba School Liverpool,"12 Columbus Way, Bridge Road, Liverpool, L21 2QG, United Kingdom","Liverpool, United Kingdom",http://www.aquascubaschoolliverpool.co.uk
S.E.A. Diving Bali,"Jl Raya Uluwatu 200X, Ungasan, South Kutuh, Sanur, No State, Indonesia","Sanur, Indonesia",http://www.seadivingbali.com
Gravity Dive Center Boracay,"c/o Bana Beach Resort, Zone 5, Balabag, , Malay, Aklan, 5608 No State, Philippines","Malay, Aklan, Philippines",https://mp.weixin.qq.com/s/hf3vM851Sy36vHEh-K59ew
Gravity Dive Center Boracay,"c/o Bana Beach Resort, Zone 5, Balabag, , Malay, Aklan, 5608 No State, Philippines","Malay, Aklan, Philippines",https://mp.weixin.qq.com/s/hf3vM851Sy36vHEh-K59ew
Aruba Watersports Center,"Sabana Liber 76, 5424 Nw 72nd Ave, ARUBAi, Aruba","ARUBAi, Aruba",http://www.arubawatersportcenter.com
Kaito Dive Centre,"Heritance Arah Resort, Raa Atoll, Maldives","Raa Atoll, Maldives",https://www.facebook.com/kaitomv
Kaito Dive Centre,"Heritance Arah Resort, Raa Atoll, Maldives","Raa Atoll, Maldives",https://www.facebook.com/kaitomv
Harbin Shark Diving Engineering Co Ltd,"150090, Heilongjiang Province - 黑龙江省Harbin, Poseidon Underwater World, No.1 Huijiang Road, Songbei District, China","Harbin, China",http://www.sharkdiving.com.cn
Harbin Shark Diving Engineering Co Ltd,"150090, Heilongjiang Province - 黑龙江省Harbin, Poseidon Underwater World, No.1 Huijiang Road, Songbei District, China","Harbin, China",http://www.sharkdiving.com.cn
Harbin Shark Diving Engineering Co Ltd,"150090, Heilongjiang Province - 黑龙江省Harbin, Poseidon Underwater World, No.1 Huijiang Road, Songbei District, China","Harbin, China",http://www.sharkdiving.com.cn
Roger's Scuba Shack,"The Round House, Bay Street, Bridgetown, St. Michael, No State, Barbados","Bridgetown, St. Michael, Barbados",http://www.rogersscubashack.com
Blue Season Bali Amed,"Jl I Ketut Natih No 88X, Purwakerti, Kec. Abang, Kabupaten, Karangasem, Bali, No State 80852, Indonesia","Karangasem, Bali, Indonesia",http://www.baliocean.com
Mundo Submarino,"Blvd. Avila Camacho 3549, Fracc. Reforma, 91919 Veracruz, Veracruz, Mexico","Veracruz, Mexico",http://www.mundosubmarino.com.mx
Mundo Submarino,"Blvd. Avila Camacho 3549, Fracc. Reforma, 91919 Veracruz, Veracruz, Mexico","Veracruz, Mexico",http://www.mundosubmarino.com.mx
Hisaichi Diver's Club,"〒100-1401, Tokyo - 東京都, 7914-1 OKAGO HACHIJOMACHI, HACHIJOJIMA, Japan","TOKYO, Japan",http://www.hisaichi.jp
West End Divers,"Calle Principal Proxima, Pura Vida, West End, Roatan, Bay Islands, No State, Honduras","Roatan, Bay Islands, Honduras",https://www.westenddivers.com/
OCEAN TATEYAMA,"〒294-0303, Chiba - 千葉県, 101-4 HAMADA, TATEYAMASHI, Japan","CHIBA, Japan",http://ocean-tateyama.com
OCEAN TATEYAMA,"〒294-0303, Chiba - 千葉県, 101-4 HAMADA, TATEYAMASHI, Japan","CHIBA, Japan",http://ocean-tateyama.com
Meridis Dive & Relax Cocogiri,"Cocogiri Island Resort, Vaavu Atoll, Maldives","Vaavu Atoll, Maldives",http://www.meridis.de
Meridis Dive & Relax Cocogiri,"Cocogiri Island Resort, Vaavu Atoll, Maldives","Vaavu Atoll, Maldives",http://www.meridis.de
B Diving & Watersports,"Cas Abao Beach, Cas Abao, Curacao","Cas Abao, Curaçao",http://www.bdivingcuracao.com
Holden Beach Scuba,"2645 Holden Beach Road, Supply, North Carolina 28462, United States","Supply, United States of America (USA)",http://www.hodenbeachscubadive.com
Holden Beach Scuba,"2645 Holden Beach Road, Supply, North Carolina 28462, United States","Supply, United States of America (USA)",http://www.hodenbeachscubadive.com
Holden Beach Scuba,"2645 Holden Beach Road, Supply, North Carolina 28462, United States","Supply, United States of America (USA)",http://www.hodenbeachscubadive.com
Ocean Guardian Dive Centre,"H. Dh. Dhipparufushi, Atoll 02160, Maldives","Atoll, Maldives",http://www.soneva.com
Ocean Guardian Dive Centre,"H. Dh. Dhipparufushi, Atoll 02160, Maldives","Atoll, Maldives",http://www.soneva.com
Scuba Viva,"Sihlfeldstr. 10, CH-8003 Zuerich, Switzerland","Zuerich, Switzerland",http://www.scubaviva.ch
Scuba Viva,"Sihlfeldstr. 10, CH-8003 Zuerich, Switzerland","Zuerich, Switzerland",http://www.scubaviva.ch
Elements,"Anantara Kihavah Villas, Kihavah Huravalhi Island, Baa Atoll, Maldives","Baa Atoll, Maldives",http://www.silversandsdiving.com
Sink Or Swim Scuba Inc.,"#2 4131 Mostar Road, Nanaimo British Columbia V9T 6A6, Canada","Nanaimo, Canada",http://www.sosscuba.ca
Sink Or Swim Scuba Inc.,"#2 4131 Mostar Road, Nanaimo British Columbia V9T 6A6, Canada","Nanaimo, Canada",http://www.sosscuba.ca
Let's Dive Tulamben,"Jl Amlapura Singaraja, Tulamben, Kec Kubu, Kabupaten, Tulamben, No State 80853, Indonesia","Tulamben, Indonesia",https://letsdivetulamben.com/
Let's Dive Tulamben,"Jl Amlapura Singaraja, Tulamben, Kec Kubu, Kabupaten, Tulamben, No State 80853, Indonesia","Tulamben, Indonesia",https://letsdivetulamben.com/
"Maui Diving - Scuba & Snorkel Center, LLC","1455 South Kihei Road, Suite 101, Kihei, Maui, Hawaii 96753, United States","Kihei, Maui, United States of America (USA)",http://www.mauidiving.com
"Maui Diving - Scuba & Snorkel Center, LLC","1455 South Kihei Road, Suite 101, Kihei, Maui, Hawaii 96753, United States","Kihei, Maui, United States of America (USA)",http://www.mauidiving.com
Komandoo Prodivers,"Kommandoo Island Resort, Lhaviyani Atoll, Maldives","Lhaviyani Atoll, Maldives",http://www.prodivers.com
Duikpunt,"Kortemolenstraat 55, 8200 Brugge, Belgium","Brugge, Belgium",https://www.duikpunt-duikschool.be
Kirk's Dive & Surf LLC,"1991 North East Jensen Beach Blvd, Jensen Beach, Florida 34957, United States","Jensen Beach, United States of America (USA)",http://www.kirksjensenbeach.com
Diver's Realm,"900 South Westland Drive, Appleton, Wisconsin 54914, United States","Appleton, United States of America (USA)",http://diversrealm.com
Axe Murderer Tours,"1067 Microbeach Road, Saipan, Northern Mariana Islands 96950, United States","Saipan, United States of America (USA)",http://www.axemurderertours.com
Sundown Diving,"22 Esplanade Street, Nanaimo British Columbia V9R 4Y7, Canada","Nanaimo, Canada",http://www.sundowndiving.com
West End Divers,"Calle Principal Proxima, Pura Vida, West End, Roatan, Bay Islands, No State, Honduras","Roatan, Bay Islands, Honduras",https://www.westenddivers.com/
Kalypso Dive Center,"Kalypso Rock's Palace Dive Center and School, Kalypso Cretan Village Resort and Spa Hotel, 74060 Karavos Beach, Plakias, Crete, Greece","Karavos Beach, Plakias, Crete, Greece",http://www.kalypsodivecenter.com
Pro Dive International Dreams Cozumel,"%Dreams Cozumel, Carretera Costera Sur KM 12.9, Zona Hotelera Sur, 77600 Cozumel, Quintana Roo, Mexico","Cozumel, Mexico",https://www.prodiveinternational.com
I 40 Ruggenti,"Via Andrea Mantegna 15, 20154 Milano No State, Italy","Milano, Italy",http://www.i40ruggenti.it
Holden Beach Scuba,"2645 Holden Beach Road, Supply, North Carolina 28462, United States","Supply, United States of America (USA)",http://www.hodenbeachscubadive.com
PACIFICA DIVING CENTER JIYUGAOKA,"〒158-0083, Tokyo - 東京都, 5-12-14 OKUSAWA, SETAGAYAKU, Japan 〒158-0083, Tokyo - 東京都, 東京都世田谷区奥沢5-12-14 1F, Japan Translate","TOKYO, Japan",https://www.pacifica-diving.com
Rahaa Dive Center,"M.Gulhazaruge, Fareedhee Magu, Male 20007, Maldives","Male, Maldives",http://www.rahaaresort.com
Odyssea Dive,"Casa Babi, Rua Do Palacio, Vilanculos, InmambaneNo State, Mozambique","Vilanculos, Inmambane, Mozambique",http://www.odysseadive.com
Subsurface Malolo,"Malolo Island Resort, Nadi Airport, Fiji","Nadi Airport, Fiji",http://fijidiving.com/
Captains Corner Dive Center,"125 Ann Street, Key West, Florida 33040, United States","Key West, United States of America (USA)",http://www.captainscorner.com
"Intl Elite Divers Training Centre, Ltd. 國際精英潛水訓練","No State, Kowloon, Ground Floor, Fulland Court, 256 Fa Yeun Street,Kowloon, Hong Kong","Kowloon, zzzz",http://www.idtc.com.hk
Aqua Trek Beqa,"1 Atoll Place, Pacific Harbour, Fiji","Pacific Harbour, Fiji",http://www.aquatrek.com
Nemo Dive Club,"Sunrise Montemare Resort, Hadaba, Sharm El Sheikh, S. Sinai, No State, Egypt","Sharm El Sheikh, S. Sinai, Egypt",http://www.nemodiveclub.com
First Coast Divers,"2777 University Blvd West Ste 4, Jacksonville, Florida 32217, United States","Jacksonville, United States of America (USA)",http://www.firstcoastdivers.com
Cupid Akabane,"〒115-0041, Tokyo - 東京都, 34-1 IWABUCHICHO, KITAKU, Japan 〒115-0041, Tokyo - 東京都, 東京都北区岩淵町34-1 山田ビル1F, Japan Translate","TOKYO, Japan",http://www.cupid.ne.jp
Speedywater,"c/ Muelle Pesquero, s/n, 33430 Candas, Asturias No State, Spain","Candas, Asturias, Spain",http://www.speedywater.com
Flipper Diving Club,"Chenla Resort, Bai Xep, Ong Lang, Phu Quoc, No State 10000, Viet Nam","Phu Quoc, Vietnam",http://www.flipperdiving.com
Tenggol Dive Buddy,"A'King Jetty, Jalan rajawali, Kuala Dungun, Dungun,Terengganu, 23000 Dungun, No State, Malaysia","Dungun, Malaysia",https://tenggol-dive-buddy.business.site/
Athlie Diving Club,"〒216-0004, Kanagawa - 神奈川県, 3-3-8 SAGINUMA MIYAMAEKU, KAWASAKISHI, Japan 〒216-0004, Kanagawa - 神奈川県, 神奈川県川崎市宮前区鷺沼3-3-8, Japan Translate","KANAGAWA, Japan",http://www.ssk-sf.com/athlie-dc
Auckland Scuba - Silverdale,"8 Keith Hay Crt, Auckland 0932, New Zealand","Auckland, New Zealand",http://www.aucklandscubadive.co.nz
Gangga Divers,,"Manado, Indonesia",
Fish In Air Bunaken,"The Vilage Bunaken Resort, Pantai Pangalisang, Bunaken island, Kota Manado, Bunaken, No State 95111, Indonesia","Bunaken, Indonesia",http://manado.fishinair.com
Scientific Diving School,"Scientific Diving School, Via Andrea Costa, 174, 40134 Bologna No State, Italy","Bologna, Italy",http://www.sdseducational.org
Divers Mast,"2900 Lansing Avenue, Jackson, Michigan 49202, United States","Jackson, United States of America (USA)",http://www.diversmast.com/
Scuba Viva,"Sihlfeldstr. 10, CH-8003 Zuerich, Switzerland","Zuerich, Switzerland",http://www.scubaviva.ch
Papua Explorers Resort,"Pinsilim Bay, Kampung Yenwaupnor, Meos Mansar, Waisai Sorong, Raja Ampat, No State 98942, Indonesia","Raja Ampat, Indonesia",http://www.papuaexplorers.com
Santa Cruz Dive House,"Rua Dr Esteves de Oliveira No 2 B, 2560-487 Silveira, Portugal","Silveira, Portugal",https://www.santacruzdivehouse.pt
Big Bubble Centre,"115A Commonwealth Drive #04-23, SINGAPORE 149596, Rep. Of Singapore","Singapore, Singapore",http://www.bigbubble.com
Wilderness Sea N' Ski,"137 George Street, Liverpool New South Wales 2170, Australia","Liverpool, Australia",http://www.wilderness.net.au
Dive Provo,"Saltmills Plaza, Unit 5, Providenciales, Turks And Caicos Islands","Providenciales, Turks and Caicos Islands",http://www.diveprovo.com
"Southeastern Divers, Inc.","2720-D Governors Drive Soutwest, Hunstville, Alabama 35805, United States","Hunstville, United States of America (USA)",http://www.sdiscuba.com
Divers World,"PO Box 917 GT, Seven Mile Shops, No State, Cayman Islands","Grand Cayman, Cayman Islands",http://www.diversworldcayman.com
Tulamben Scuba,"Tulamben, Kec Kubu Kabupaten, Karangasam, Bali, No State 80853, Indonesia","Bali, Indonesia",https://www.tulambenscuba.com
New KK Holiday,"G29 Wisma Sabah, Ground Floor, Wisma Sabah, Sabah, 88000 Kota Kinabalu, No State, Malaysia","Kota Kinabalu, Malaysia",http://www.newkkholiday.com
Tenggol Dive Buddy,"A'King Jetty, Jalan rajawali, Kuala Dungun, Dungun,Terengganu, 23000 Dungun, No State, Malaysia","Dungun, Malaysia",https://tenggol-dive-buddy.business.site/
TB Menjangan Carib Dive Center,"Jln raya seririt-gilmanuk, Kabupaten, Menjangan, No State 81155, Indonesia","Menjangan, Indonesia",http://www.tbmenjangan.com
Pro Dive International Ocean El Faro,"Hotel Ocean El Faro, Carretera De Uvero Alto S/N, 23000 Uvero Alto, Dominican Rep.","Uvero Alto, Dominican Republic",https://www.prodiveinternational.com/
Dive Tours Szkola Nurkowania,"ul. Janowo 4, 61-680 Poznań, Poland","Poznań, Poland",http://www.divetours.pl
Marine Center Vabbinfaru-Ihuru,"Banyan Tree Vabbinfaru, North Male Atoll, Maldives","North Male Atoll, Maldives",https://www.dhawa.com/maldives/dhawa-ihuru
Aquabaires Buceo,"Av Diego Carman 681, San Isidro, 1642 Buenos Aires, No State, Argentina","Buenos Aires, Argentina",https://www.aquabairesbuceo.com.ar
Jean-Michel Cousteau Resort,"P O Box 333, Savu Savu, Fiji","Savu Savu, Fiji",http://www.jeanmichelcousteaudiving.com/
Scuba Safaris (pvt) Ltd.,"25c, Barnes Place, Colombo Sri Lanka, Colombo, Sri Lanka","Colombo, Sri Lanka",http://underwatersafari.org/index.php/scuba-diving/
Aqua Sports Distributing of Central CA,"1616 East Shields Avenue, Fresno, California 93704, United States","Fresno, United States of America (USA)",http://www.aquasports.com
Deep Sea World Aquarium,"Battery Quarry, North Queensferry, Fife, KY11 1JR, United Kingdom","Fife, United Kingdom",http://www.deepseaworld.co.uk
DIVE IN OKINAWA,"〒902-0065, Okinawa - 沖縄県, #101 2-18-1 TSUBOYA, NAHASHI, Japan 〒902-0065, Okinawa - 沖縄県, 沖縄県那覇市壺屋2-18-1 壺屋店舗101, Japan Translate","OKINAWA, Japan",http://www.diveinokinawa.com
Dive Code,"Kalogria, Stoupa, 24024 Messinia, Greece","Messinia, Greece",http://www.divecodegreece.com
Maxi Sub A.S.D,"Piazza Brunelleschi 19, 50018 Scandicci – Firenze No State, Italy","Scandicci – Firenze, Italy",http://www.maxisub.it
Diving School Marea Meieki,"〒451-0042, Aichi - 愛知県, 2-12-2-2F NAGONO NISHIKU, NAGOYASHI, Japan 〒451-0042, Aichi - 愛知県, 愛知県名古屋市西区那古野2-12-12 名駅アネクスビル2F, Japan Translate","AICHI, Japan",https://www.marea-nagoya.jp/
Salty Dog Dive Center,"10 King Court, New Castle, Delaware 19720, United States","New Castle, United States of America (USA)",http://www.saltydogdivecenter.com
Wind & Water Charters,"111 Washington Street, Ketchikan, Alaska 99901, United States","Ketchikan, United States of America (USA)",https://windandwaterdiveshop.com
Cabo Adventures,"Boulevard Paseo De La Marina, Esquina Malecon, Lote 7 A, 23410 Cabo San Lucas, Baja California Sur, Mexico","Cabo San Lucas, Mexico",http://www.cabo-adventures.com
Ocean Tribe,"〒158-0083, Tokyo - 東京都, 1F 6-20-1 OKUSAWA, SETAGAYAKU, Japan 〒158-0083, Tokyo - 東京都, 東京都世田谷区奥沢6-20-1 ユタカフォレスト自由が丘1 1F, Japan Translate","TOKYO, Japan",http://www.oceantribe.jp/
Kirk's Dive & Surf LLC,"1991 North East Jensen Beach Blvd, Jensen Beach, Florida 34957, United States","Jensen Beach, United States of America (USA)",http://www.kirksjensenbeach.com
Dive Zone Scuba,"2809 Miller Ranch Road, Suite 417, Pearland, Texas 77584, United States","Pearland, United States of America (USA)",http://www.divezonescuba.com
Divi Dive Bonaire,"Divi Resorts, 40 Julio A. Abraham Boulevard, Kralendijk, Bonaire, Sint Eustatius, And Saba","Kralendijk, Sint Eustatius",https://dividive.com/
Tangalooma Dive and Watersports,"Tangalooma Island Resort, Tangalooma, Moreton Island Queensland 4025, Australia","Tangalooma, Moreton Island, Australia",http://www.tangatours.com
Island Dive Center,"Golden Isles Marina, 101 Marina Drive, St Simons Island, Georgia 31522, United States","St Simons Island, United States of America (USA)",http://www.islanddivecenter.com
"Sipadan-Mabul Resort, Sdn Bhd","Lot A-1-G, Block A, Signature Office, KK Times Square, Off Coastal Highway, Kota Kinabul, 88100 Sabah, No State, Malaysia","Sabah, Malaysia",http://www.sipadanmabulresort.com
Blenheim Dive Centre,"9 Scott Street, Blenheim, New Zealand","Blenheim, New Zealand",https://blenheimdivecentre.nz/
Wind & Water Charters,"111 Washington Street, Ketchikan, Alaska 99901, United States","Ketchikan, United States of America (USA)",https://windandwaterdiveshop.com
Como Sub,"Viale Geno 14, 22100 Como No State, Italy","Como, Italy",http://www.comosub.it
Aqua Center,"628 Bellevue Street, Green Bay, Wisconsin 54302, United States","Green Bay, United States of America (USA)",http://www.aquacntr.com
Sea Hunt Scuba,"309 State Road 16, St Augustine, Florida 32084, United States","St Augustine, United States of America (USA)",http://www.seahuntscuba.com
Aquabaires Buceo,"Av Diego Carman 681, San Isidro, 1642 Buenos Aires, No State, Argentina","Buenos Aires, Argentina",https://www.aquabairesbuceo.com.ar
MSTS North Blue,"M. Whaleshark, K. Male 20213, Maldives","K. Male, Maldives",http://www.mstsmaldives.com
Sac City Scuba,"11335-B Folsom Boulevard, Rancho Cordova, California 95742, United States","Rancho Cordova, United States of America (USA)",http://www.saccityscuba.com
Bambu Divers Pondok Bambu Resort,"Jalan Raya Candidasa, Karangasem Bali, Candidasa, No State 80811, Indonesia","Candidasa, Indonesia",http://www.bambudivers.com/
Cupid Akabane,"〒115-0041, Tokyo - 東京都, 34-1 IWABUCHICHO, KITAKU, Japan 〒115-0041, Tokyo - 東京都, 東京都北区岩淵町34-1 山田ビル1F, Japan Translate","TOKYO, Japan",http://www.cupid.ne.jp
Shark Expedition Fuvahmulah,"Dharuma, Hoadhadu, Havitha Goalhi, Fuvamulah, Gnaviyani Atoll 18018, Maldives","Gnaviyani Atoll, Maldives",http://www.shakexpeditionfuvamulah.com
Mr. Krabs Resort Inc.,"Mr Krabs Resort, Sabang,, 5230 Puerto Galera, , Oriental Mindoro, 5203 No State, Philippines","Oriental Mindoro, Philippines",http://krabsdiving.com
Isla Diving Di Marcello Liori,"Viale Cantieri SNC, 09014 Carloforte (SU) No State, Italy","Carloforte (SU), Italy",http://www.isladiving.it
Bananarama Resort & Dive Center,"West Bay Beach, Roatan, Bay Islands, No State, Honduras","Roatan, Bay Islands, Honduras",http://bananarama.com/
Ari Atoll Divers,"Chandhanee magu, Fazaa Adh.Omadhoo 00020, Maldives","Fazaa Adh.Omadhoo, Maldives",http://www.ariatolldivers.com
Blackpool Area Diving Centre,"32 Beechwood Drive, Thornton-Cleveleys, Blackpool, FY5 5EJ, United Kingdom","Blackpool, United Kingdom",https://www.blackpoolareadivingcentre.co.uk
Sea U Diving,"Danao Pandlao Bohol, Near Don Julio Apartelle (in Front), , Bohol, 6340 No State, Philippines","Bohol, Philippines",https://mp.weixin.qq.com/s/8x2xB348Sbfq9HLG3jd9Bw
Diventures Vienna,"510 Mill Street NE, Vienna, Virginia 22180, United States","Vienna, United States of America (USA)",https://www.diventures.com/locations/vienna/
Tecdive,"Humikkalanrinne 1, FI-00940 Helsinki, Finland","Helsinki, Finland",http://www.tecdive.fi
Adventure Scuba Diving Bali,"50 Dewi Saraswati, Seminyak, Kerobokan Kuta Utara, Bali, Seminyak, No State 80361, Indonesia","Seminyak, Indonesia",http://www.adventure-scuba-diving.com
Yellow Sub Tarifa,"Av. de la Constitución, 6, Local 1, 11380 Tarifa (Cadiz) No State, Spain","Tarifa (Cadiz), Spain",http://www.divingtarifa.com
Dive Grenada,,"St George's, West Indies, Grenada",
Chloe's Diving Center,"Continental Hotel, Hurghada, No State, 84511, Egypt","Hurghada, Egypt",https://chloes-diving.com/
JR Dive,"No State Gyeonggi-do, #108, 22 Wiryeseoil-ro Sujeong-gu, Seongnam-si, 13647, South Korea","Gyeonggi-do, South Korea",http://www.jrdive.com
Piter-Dive,"Kultury 1, St Petersburg, No State, 195274, Russian Federation","St Petersburg, Russia",http://www.piter-dive.ru
SUB AQUA Divecenter Thulhagiri,"Thulhagiri Island Resort, North Male Atoll, Maldives","North Male Atoll, Maldives",http://www.subaqua-divecenter.com
Piscis Diving,"Carrer Escullera del Port s/n, Sant Feliu de Guixols, 17220 Girona No State, Spain","Girona, Spain",http://www.piscisdiving.com
Aqua Diving Academy,"382 Commercial Street, Portland, Maine 04101, United States","Portland, United States of America (USA)",http://www.aquadivingacademy.com
Amber Scuba Dive Centre,"Unit No 3-9, Level 3, Seafest Square, 91308 Jalan Kastam, Semporna, No State, Malaysia","Jalan Kastam, Semporna, Malaysia",https://www.douyin.com/user/MS4wLjABAAAA0fliw5VOVSYIDdSJ_QrltbCrqhXm9aLd2YvjkwF9p_A
Zandokhan-Diving,"Overveld 17, Eori: Nl2388218827, 3848 BT Harderwijk, Netherlands","Harderwijk, Netherlands",http://www.zandokhan.com
Sea Explorers Cabilao,"Cambaquiz, Cabilao Island, Loon, , Bohol, 6327 No State, Philippines","Bohol, Philippines",http://www.sea-explorers.com/
Neptune Diving Center,"Street 13 - Gazertalhecin, No State, United Arab Emirates","Fujairah, Dibba, Al-Hisn, United Arab Emirates",http://www.neptunecenter.ae
Royal Octopus Dive Center,"Kolymbari, Chania, 73006 Crete, Greece","Crete, Greece",http://www.royaloctopus.gr
"Aquatic Adventures, Inc.","13830 West Greenfield Avenue, Brookfield, Wisconsin 53005, United States","Brookfield, United States of America (USA)",https://diveaai.com/
Prodivers Jawakara,"Jawakara Islands Maldives, Lhaviyani Atoll, Maldives","Lhaviyani Atoll, Maldives",http://www.prodivers.com
Rebel Diving,"Zomerdijk 8, 7946 LZ Wanneperveen, Netherlands","Wanneperveen, Netherlands",https://www.rebeldiving.nl
Manta Divers,"Guraidhoo, South Male, Atoll 08080, Maldives","Atoll, Maldives",https://www.manta-divers.com/
Secret of the Sea,"Jánská 12, 60200 Brno, Czech Rep.","Brno, Czech Republic",http://www.skola-potapeni.eu
Chalki Dive Center,"Chalki Dodecanese, 85110 Halki, Greece","Halki, Greece",http://www.chalkdive.com
D2U Club,"32 Boulevard Akademika Vernadskogo Avnue, Kyiv, No State, 03142, Ukraine","Kyiv, Ukraine",http://d2u.club
Scuba Safaris (pvt) Ltd.,"25c, Barnes Place, Colombo Sri Lanka, Colombo, Sri Lanka","Colombo, Sri Lanka",http://underwatersafari.org/index.php/scuba-diving/
Shark Fin Diving Center,"Schinia Beach, Agios Nikolaos, 63078 Sithonia, Halkidiki, Greece","Sithonia, Halkidiki, Greece",http://www.sharkfin.gr
Vomo Island Resort,"Vomo Island Resort, 26 Nasoki Street, Lautoka, Fiji","Lautoka, Fiji",http://www.vomofiji.com
Sea Dream Okierabu,"〒891-9233, Kagoshima - 鹿児島県, 1132-1 Shimoshiro Chinacho, Oshimagun, Japan 〒891-9233, Kagoshima - 鹿児島県, 鹿児島県大島郡知名町下城1132-1, Japan Translate","Kagoshima, Japan",http://www.okierabu.net
Tauchcenter Magdeburg,"Unterhorstweg 26, 39122 Magdeburg, Germany","Magdeburg, Germany",http://www.tauchcenter-magdeburg.de
Elements,"Anantara Kihavah Villas, Kihavah Huravalhi Island, Baa Atoll, Maldives","Baa Atoll, Maldives",http://www.silversandsdiving.com
Reef Pirates Hawaii,"7192 Kalanianaole Hwy D100B, Honolulu, Oahu, Hawaii 96825, United States","Honolulu, Oahu, United States of America (USA)",http://www.reefpirates.com
Scuba Side Diving Center,"Hotel Turquoise, Sorgun Mahallesi, Acisu Mevkii, No:4, 07600 Side, Sorgun, Antalya/No State, Turkey","Side, Sorgun, Antalya, Turkey",http://www.scubaside.com
Robin Hood Watersports,"152 Leeds Road, Heckmondwike, W. Yorkshire, WF16 9BJ, United Kingdom","Heckmondwike, W. Yorkshire, United Kingdom",http://www.rohodive.co.uk/
Best Dives Centara Ras Fushi,"Centara Ras Fushi Resort & Spa, Giravaru, North Male Atoll 20225, Maldives","North Male Atoll, Maldives",http://www.bestdivesmaldives.com
Centrum Nurkowe UBOOT,"ul. Patronacka 5, 58-160 Swiebodzice, Poland","Swiebodzice, Poland",http://www.uboot.com.pl
Piter-Dive,"Kultury 1, St Petersburg, No State, 195274, Russian Federation","St Petersburg, Russia",http://www.piter-dive.ru
Dive 360 Pemba Ltd,"PO Box 22, Wete, Pemba, Zanzibar, Tanzania (united Rep.)","Pemba, Zanzibar, Tanzania",http://www.themantaresort.com
Coraya Divers Naga Bay,"Sintido Sharm El Naga, Safaga, Red Sea, No State, Egypt","Safaga, Red Sea, Egypt",http://www.coraya-divers.com/en/
Aquanaut India,"#77, 1st Floor, J.S Towers, Brigade Road, Bengaluri, Karnataka 560025, No State, India","Karnataka, India",http://www.aquanaut.in
Jean-Michel Cousteau Resort,"P O Box 333, Savu Savu, Fiji","Savu Savu, Fiji",http://www.jeanmichelcousteaudiving.com/
La Sirene Plongee,"Village de vacance la sirene- Hippocampo, Route de Taxo, 66700 Argeles Sur Mer, France","Argeles Sur Mer, France",http://www.lasireneplongee.com
Eat Sleep and Dive,"Rorschacherstrasse 39 a, CH-9400 Rorschach, Switzerland","Rorschach, Switzerland",http://www.tauchweb.swiss
Sportsco-Aqua Trek,"2079 West Sunset, Springdale, Arkansas 72762, United States","Springdale, United States of America (USA)",http://www.sportscoscuba.com
Discovery Diving bv,"Graaf Lodewijkstraat 40, Hardinxveld, 3372CD Giessendam, Netherlands","Giessendam, Netherlands",http://www.discoverydiving.nl
Deep South Divers,"436 Gibson Road, Newnan, Georgia 30263, United States","Newnan, United States of America (USA)",http://www.deepsouthdivers.com
Papa's Diving Studio,"〒100-2101, Tokyo - 東京都, OKUMURA CHICHIJIMA, OGASAWARAMURA, Japan 〒100-2101, Tokyo - 東京都, 東京都小笠原村父島字奥村, Japan Translate","TOKYO, Japan",http://papasds.com
"Brass Anchor, LLC","519 East Church Street, Frederick, Maryland 21701, United States","Frederick, United States of America (USA)",http://www.brassanchor.com/
Scuba Du S.A. de C.V.,"Presidente Intercontinental Resort & Spa, Carr. A Chankanaab Km. 6.5, 77600 Cozumel, Quintana Roo, Mexico","Cozumel, Mexico",http://www.scubadu.com
"Intl Elite Divers Training Centre, Ltd. 國際精英潛水訓練","No State, Kowloon, Ground Floor, Fulland Court, 256 Fa Yeun Street,Kowloon, Hong Kong","Kowloon, zzzz",http://www.idtc.com.hk
Pelicano Sport,"Hotel Ocean Blue, Carretera Arena Gorda, Punta Cana, Bavaro, Dominican Rep.","Punta Cana, Bavaro, Dominican Republic",http://www.pelicanosport.biz
Dive House Wonder Land,"〒858-0922, Nagasaki - 長崎県, 986 KAKOMAECHO, SASEBOSHI, Japan 〒858-0922, Nagasaki - 長崎県, 長崎県佐世保市鹿子前町986, Japan Translate","NAGASAKI, Japan",http://www.d-wonder.com
