name,physical_address,location,website
mic21 Umeda,"〒530-0027, Osaka - 大阪府, 3-3 DOYAMACHO KITAKU, OSAKASHI, Japan","OSAKA, Japan",http://www.mic21.com/n/shop/detail?10
Shark Diving Shop,"Sabang, PG Oriental Mindoro, , Puerto Galera, 5203 No State, Philippines","Puerto Galera, Philippines",
Lofoten Diving AS,"Skarsjyveien 67, 8373 Ballstad, Norway","Ballstad, Norway",http://www.lofoten-diving.com
Københavns Dykkerskole,"Amager Strandvej 40A, 2300 København, Denmark","København, Denmark",http://www.koebenhavnsdykkerskole.dk
Lay Trang Diving,"3/2 Nangnoi Rd, Muang Trang, Trang, No State 92000, Thailand","Trang, Thailand",http://www.laytrangdiving.com
Nobeoka Marine Service,"〒882-0017, Miyazaki - 宮崎県, 3357-1 KAWASHIMAMACHI, NOBEOKASHI, Japan","MIYAZAKI, Japan",http://www.marine.gr.jp/
Dive Spot,"Vasileos Konstantinou 32 r, 16672 Vari, Greece","Vari, Greece",http://www.divespot.gr
Elcielo Resort,"Elcielo Resort, Masaplod Norte, Dauin Negros Oriental, , Dumaguete, 6217 No State, Philippines","Dumaguete, Philippines",http://www.elcieloresort.com/
White Wave Maldives PVT LTD,"STO Trade Center ( 01-05 ) First Floor, Orchid Magu, Male' City 41049, Maldives","Male' City, Maldives",http://www.whitewavemaldives.com
Shanghai Seastar Diving Club,"200125, Shanghai Municipality - 上海市 Shànghǎi ShìShanghai, Shanghai, pudong district, dongfang sports center,, yaolong road, No 8., China","Shanghai, China",http://www.sdc.ssc.sh.cn
Planet Sea Lugano,"c/o Lido di Lugano, Via Foce, CH-6900 Lugano, Switzerland","Lugano, Switzerland",http://www.planetsealugano.ch
Scuba Time,"Hammaapilim 5 Cfar, Shmariahoo, Israel","Shmariahoo, Israel",http://www.scuba-time.com
Medaqua,,"L'Estartit (girona), Spain",
Star Seas Diving Center,"2307 Almuaadi, Al Hamra Dist., Secondary #7162, Jeddah 23212, Saudi Arabia","Jeddah, Saudi Arabia",http://www.amiralbehar.com
La Pang Resort,"Danao, Panglao, , Bohol, 05663 No State, Philippines","Bohol, Philippines",https://www.lapangresort.com/
Diving School Marea Okinawa,"〒900-0037, Okinawa - 沖縄県, 1-9-23 TSUJI, NAHASHI, Japan","OKINAWA, Japan",http://marea-oki.jp
SCUBAINFO - MUNKYEONG,"No State Gyeongsangbuk-do, 212, Sinheung-ro, Mungyeong_si, Mungyeong_si, 36967, South Korea","Gyeongsangbuk-do, South Korea",
Ranum Efterskole College,"Seminarievej 23, 9681 Ranum, Denmark","Ranum, Denmark",http://www.ranumefterskole.dk
Scubalibre di Casini Danilo,"Via Georges Bizet, 9, 42124 Reggio Emilia RE No State, Italy","Reggio Emilia RE, Italy",http://www.scubalibrereggioemilia.com
Texan Scuba @ The Blue Lagoon,"649 Pinedale Road, Huntsville, Texas 77320, United States","Huntsville, United States of America (USA)",http://www.texanscuba.com
Marine Pocket,"〒600-8861, Kyoto - 京都府, 82 7JOGOSHONOUCHIKITAMACHI, SHIMOGYOKU KYOTOSHI, Japan","KYOTO, Japan",http://www.diving-s.com
Eastern Caribbean Diving,"Harbor Club St. Lucia, Rodney Bay, Gros Islet, Saint Lucia","Gros Islet, Saint Lucia",http://www.easterncaribbeandivingstlucia.com
Blue Diving Academy,"Via C. Marchesi 14, 35010 Limena (PD) No State, Italy","Limena (PD), Italy",http://www.bluedivingacademy.com
Peps Dive Thailand,"82/2, 82/4, Moo 4 Patak Rd, Rawai Sub-district, Muang, Phuket, No State 83100, Thailand","Phuket, Thailand",
Saihat Divers,"Dharah, Half Moob Bay, Palme Beach Resort, Saihat 32437-7503, Saudi Arabia","Saihat, Saudi Arabia",https://www.instagram.com/saihatdivers/
uminoGAKKO,"〒414-0044, Shizuoka - 静岡県, 1311-6 KAWANA, ITOSHI, Japan","SHIZUOKA, Japan",http://www.umi-dream.jp
Liquid Dive Adventures Finland,"Lasikaari 6 A 12, FI-33960 Pirkkala, Finland","Pirkkala, Finland",http://www.liquiddiveadventures.com
Amola Diver,"Purok 7, , Bil-Isan, 6300 No State, Philippines","Bil-Isan, Philippines",http://www.amoladiver.com
Argentina YMCA,"Reconquista 439, Ciudad Autonoma de Buenos Aires, 1003 Buenos Aires, No State, Argentina","Buenos Aires, Argentina",http://www.ymcabuceo.com.ar/
mic21 Yokohama,"〒231-0031, Kanagawa - 神奈川県, 2-4-1 BANDAICHO NAKAKU, YOKOHAMASHI, Japan","KANAGAWA, Japan",http://www.mic21.com/n/shop/detail?3
Planet Sea Lugano,"c/o Lido di Lugano, Via Foce, CH-6900 Lugano, Switzerland","Lugano, Switzerland",http://www.planetsealugano.ch
Rocket Friends Diving,"No State, New Territories, Room A1, 18/F, Richwealth Industrial Building, Yeu, Hong Kong","New Territories, zzzz",https://www.facebook.com/rocketfriendsdiving
LA - Club,"Bulvar Druzhbi Narodiv 26/1, office 2, Kiev, No State, 01103, Ukraine","Kiev, Ukraine",http://www.la-club.com.ua/
Coastline Diving,"King Abdullah University, KAUST, Thuwal, Jeddah / Makkah 21352, Saudi Arabia","Jeddah / Makkah, Saudi Arabia",http://www.facilities.kaust.edu.sa
Dive Life,"Avenida De Las Fuentes 184, Local 510, Lomas De Tecamachalco, 53950 Naucalpan De Juarez, México, Mexico","Naucalpan De Juarez, Mexico",http://www.divelife.mx
Shanghai Seastar Diving Club,"200125, Shanghai Municipality - 上海市 Shànghǎi ShìShanghai, Shanghai, pudong district, dongfang sports center,, yaolong road, No 8., China","Shanghai, China",http://www.sdc.ssc.sh.cn
Keep Diving Bohol,"Keep Diving Resort, Danao Panglao, , Bohol, No State, Philippines","Bohol, Philippines",
Marine Studio Dragonlady,"〒415-0012, Shizuoka - 静岡県, C/O HOTEL IZUKYU 2732-7, SHIRAHAMA SHIMODASHI, Japan","SHIZUOKA, Japan",http://dragonl.o.oo7.jp/
Diving Supplyer Smile,"〒900-0037, Okinawa - 沖縄県, 2-24-8 TSUJI, NAHASHI, Japan","OKINAWA, Japan",http://www.ds-smile.com
Divers West,"257 South Rosemead Boulevard, Pasadena, California 91107, United States","Pasadena, United States of America (USA)",http://www.divers-west.com
Diving School Kanau,"〒675-0025, Hyogo - 兵庫県, 1396-2 YOTA ONOECHO, KAKOGAWASHI, Japan","HYOGO, Japan",http://kanau-diving.co.jp
Diving College Tartaruga,"〒537-0021, Osaka - 大阪府, 2-15-11 Higashinakamoto, Higashinariku Osakashi, Japan","Osaka, Japan",http://www.dc-tartaruga.com
Shark Diving Shop,"Sabang, PG Oriental Mindoro, , Puerto Galera, 5203 No State, Philippines","Puerto Galera, Philippines",
Aquaexcursions Diving Centers,"Carretera Federal Chetumal, Pto. Joaerz, No. Km 256-100, Hotel Grand Palladium, 77710 Akumal, Quintana Roo, Mexico","Akumal, Mexico",http://www.aquaexcursions.com.mx
Saihat Divers,"Dharah, Half Moob Bay, Palme Beach Resort, Saihat 32437-7503, Saudi Arabia","Saihat, Saudi Arabia",https://www.instagram.com/saihatdivers/
Scuba Diving Air,"〒812-0062, Fukuoka - 福岡県, 1-47-13 MATSUSHIMA HIGASHIKU, FUKUOKASHI, Japan","FUKUOKA, Japan",http://www.air-diving.com
Navys Waterworld Dive Center,"Kamari Beach, 84700 Santorini, Greece","Santorini, Greece",http://www.navyswaterworld.gr
LP Diving & Marine Services,"Unit 4, Pillaton Hall Farm, Pillaton, Penkridge, Staffordshire, ST19 5RZ, United Kingdom","Penkridge, Staffordshire, United Kingdom",http://www.lpdiving.co.uk
Planet Sea Lugano,"c/o Lido di Lugano, Via Foce, CH-6900 Lugano, Switzerland","Lugano, Switzerland",http://www.planetsealugano.ch
My Divers,"No State Jeju-si, jeju-do, 14-28 Sinchonbuk 3-gil, Jocheon-eup, 63337, South Korea","Jeju-si, jeju-do, South Korea",http://www.mydivers.co.kr
Liquid Dive,"c/o Centro Natatorio ""Pia Grande"", Via Augusto Murri 37, 20900 Monza No State, Italy","Monza, Italy",
Argentina YMCA,"Reconquista 439, Ciudad Autonoma de Buenos Aires, 1003 Buenos Aires, No State, Argentina","Buenos Aires, Argentina",http://www.ymcabuceo.com.ar/
Argentina YMCA,"Reconquista 439, Ciudad Autonoma de Buenos Aires, 1003 Buenos Aires, No State, Argentina","Buenos Aires, Argentina",http://www.ymcabuceo.com.ar/
Scuba Master co,"North Abhur, Al amwaj Dist, Jeddah, Saudi Arabia","Jeddah, Saudi Arabia",http://www.scubamaster.ws
mic21 Yokohama,"〒231-0031, Kanagawa - 神奈川県, 2-4-1 BANDAICHO NAKAKU, YOKOHAMASHI, Japan","KANAGAWA, Japan",http://www.mic21.com/n/shop/detail?3
MARINE CLUB BERRY,"〒905-0026, Okinawa - 沖縄県, 115-2 AZA KISE, NAGOSHI, Japan","OKINAWA, Japan",http://top.berry7.com/
Scubaworld,"Calle Geminis 28, Orihuela Costa, 03189 Alicante No State, Spain","Alicante, Spain",http://www.divecostablanca.com
Dive Team,"196/1 Tetsabanrangraknua, Soi 8 Jatujak, Bangkok, No State 10900, Thailand","Bangkok, Thailand",https://www.diveteamth.com/
Lofoten Diving AS,"Skarsjyveien 67, 8373 Ballstad, Norway","Ballstad, Norway",http://www.lofoten-diving.com
Hope of Spring Dive,"Al Salamah, Al Yamama Street, Jeddah 21352, Saudi Arabia","Jeddah, Saudi Arabia",http://www.hopespringdive.com
Meteor Diving Center,,"Pingtung, Taiwan",
W-SPORT DIVING CENTER 威鯨潛水訓練中心,"No StateHsinchu, 310021台湾省新竹县竹东镇员山路401号, Taiwan","Hsinchu, Taiwan",http://www.w-resorts.com
Medaqua,"Passeig Maritim 13, 17258 L'Estartit (girona) No State, Spain","L'Estartit (girona), Spain",http://www.medaqua.com
Keep Diving,"Sabang, Puerto Galera, Oriental Mindoro, , Puerto Galera, 5203 No State, Philippines","Puerto Galera, Philippines",https://www.pgkeepdiving.wix.com
Ocean Dive PG,"Qing Feng Resort, Big Lalaguna, Barangay Sabang, , Puerto Galera, Mindoro, 5203 No State, Philippines","Puerto Galera, Mindoro, Philippines",http://www.oceandive.cn
"Brabant, Sealand & Limburg Diving","Port Zelande 2, Eori: Nl5580358683, 3253 MG Ouddorp, Netherlands","Ouddorp, Netherlands",http://www.sealanddiving.nl
Fish Island Crew,"〒100-0101, Tokyo - 東京都, 262-3 AZA KITANOYAMA MOTOMACHI, OSHIMACHO, Japan","TOKYO, Japan",https://www.fic-web.com
Mediterranean Dive Center,"95 Alexandrou Papanastasiou Street, (Vas Pavlou Street), 18533 Kastella - Piraeus, Greece","Kastella - Piraeus, Greece",http://www.pozidis.gr
Sandals La Source,"Pink Gin Beach, St.George's, Grenada (west Indies)","St.George's, Grenada",http://www.sandals.com/scuba
Aquaventure Scuba & Travel,"10024 County Road 81, Maple Grove, Minnesota 55369-4069, United States","Maple Grove, United States of America (USA)",http://www.aquaventurescuba.com
Aquaventure Scuba & Travel,"10024 County Road 81, Maple Grove, Minnesota 55369-4069, United States","Maple Grove, United States of America (USA)",http://www.aquaventurescuba.com
SHONANDIVE HAYAMA TANK SERVICE,"〒240-0111, Kanagawa - 神奈川県, 2420-101 ISSHIKI, HAYAMAMACHI MIURAGUN, Japan","KANAGAWA, Japan",https://shonandive.com/lp/
Aqua Dive & Water Sports,,"Lh. Naifaru, Maldives",
"Kohala Divers, Ltd.","Po Box 44940, Kawaihae Shopping Center, Bay 1, Kawaihae, Hawaii, Hawaii 96743, United States","Kawaihae, Hawaii, United States of America (USA)",http://www.kohaladivers.com
El Rei del Mar,"Avenida De Grecia 5, 17258 L'Estartit (girona) No State, Spain","L'Estartit (girona), Spain",http://www.elreidelmar.com
Aqaba Sharks Bay Divers,"Al Hammamat at Tunisiya St, PO Box 67, Aqaba 77110, Jordan","Aqaba, Jordan",http://www.aqabasharksbaydivers.com
Pattaya Scuba Adventures,,"Chonburi, Thailand",
AquaMarine Diving - Bali,"Jl Petitenget 2a, Kuta Bali, Seminyak, No State 80361, Indonesia","Seminyak, Indonesia",http://www.aquamarinediving.com
White Seal,"Fuchika Street 10/2, St Petersburg, No State, 191119, Russian Federation","St Petersburg, Russia",https://whiteseal.club/
Beyond the Corals,,"Kralendijk, Sint Eustatius",
Cebu Fun Divers,"Private Road, Panagsama Beach, Cebu, , Moalboal, 6032 No State, Philippines","Moalboal, Philippines",http://www.cebufundivers.com
Aloha Diving™,"87/18 Moo 2, T.Rawai A.Muang, Phuket, No State 83130, Thailand","Phuket, Thailand",https://alohadiving.com
Southpoint Divers,"606 Front street, Key West, Florida 33040, United States","Key West, United States of America (USA)",http://www.southpointdivers.com
Abyss Ocean World,"Jalan Raya Gilimanuk, Seririt Pemuteran, Buleleng, Pemuteran, No State 81155, Indonesia","Pemuteran, Indonesia",https://www.abyssoceanworld.com
The Scuba Shop SXM,"#16 Airport Road, La Palapa Marina, Simpson Bay, Sint Maarten","Simpson Bay, Sint Maarten",http://www.thescubashopsxm.com
Albatros Diving,"Xaloc, 5. Cala Bona, 07559 Cala Millor/Mallorca No State, Spain","Cala Millor/Mallorca, Spain",http://www.albatros-diving.com
Scubacao Diving Adventures,"Nijmegenstraat 41 A-B, Willemstad, Curacao","Willemstad, Curaçao",http://www.scubacao.com
Argonauta Cala Gonone,"Via Flumendosa 4, Cala Gonone, 08020 Nuoro - Sardegna No State, Italy","Nuoro - Sardegna, Italy",http://www.argonauta.it
CTDiver,"946, No StatePingtung, No 85-5 Daguang road, Hengchun Township, Taiwan","Pingtung, Taiwan",http://www.ctdiver.com
CTDiver,"946, No StatePingtung, No 85-5 Daguang road, Hengchun Township, Taiwan","Pingtung, Taiwan",http://www.ctdiver.com
Academia Aquatica,"Mierová 111, 82105 Bratislava, Slovakia","Bratislava, Slovakia",http://www.academiaaquatica.sk
Atlantida Centro de Buceo,"Carrera 1 A No 17 Esquina, Rodadero, Santa Marta, No State,, Colombia","Santa Marta, Colombia",http://www.atlantidabucea.com
Scuba Zone Dahab,"Mashraba Street, El Jawhara Hotel Dahab, South Sinai, No State, 46617, Egypt","South Sinai, Egypt",http://www.scubazonedahab.com
Scuba Zone Dahab,"Mashraba Street, El Jawhara Hotel Dahab, South Sinai, No State, 46617, Egypt","South Sinai, Egypt",http://www.scubazonedahab.com
Atoll Divers Seychelles,"Beau Vallon, Mahe, No State, Seychelles","Mahe, Seychelles",https://divingseychelles.com/
Sun Diving Center,"WelleDevala Road, Yakdehimulla, Unawatuna, Galle, Southern, 80600, Sri Lanka","Galle, Southern, Sri Lanka",http://www.sundivingsrilanka.com
Noohiri Diving & Water Sport Center,"A.Atoll, Feridhoo Island 06090, Maldives","Feridhoo Island, Maldives",http://www.noohiri.com
Keppel Dive,"The Spit, Great Keppel Island Queensland 4703, Australia","Great Keppel Island, Australia",http://greatkeppelwatersports.com.au/
Nava Scuba Diving,"18/25 Moo 3, Chalok, Suratthani, Koh Tao, No State 84360, Thailand","Koh Tao, Thailand",https://www.navascuba.com/
DiveINN Potapacsky Klub,"dona Sandtnera 29, 90201 Pezinok, Slovakia","Pezinok, Slovakia",https://www.kurzypotapania.sk/
Asd Capo Milazzo Diving Center,"Via Francesco Crispi 1, c/o Circolo del Tennis e Vela, 98057 Milazzo (ME) No State, Italy","Milazzo (ME), Italy",http://www.capomilazzodivingcenter.com
West Side Scuba Centre,"Boatyard Complex, Bay Street, St. Michael, No State, Barbados","St. Michael, Barbados",https://divewestsidescuba.com/
Glups Diving Cambrils,"Avenida Diputacion 38 Local 2, 43850 Cambrils No State, Spain","Cambrils, Spain",http://www.glupsdiving.com
Glups Diving Cambrils,"Avenida Diputacion 38 Local 2, 43850 Cambrils No State, Spain","Cambrils, Spain",http://www.glupsdiving.com
Scuba Journey,,"AA. Ukulhas, Maldives",
Coveñas Diving Co,"Calle 12, #21-65, Bajo Hotel Estrella, Coveñas, No State, 706050, Colombia","Coveñas, Colombia",http://www.covenasdiving.com
Blue Note Scuba Diving,"Marina Fonatur, Carr Costera Sur Km 6,, Zona, Hotelera Sur, San Miguel de Cozumel, 77600 Cozumel, Quintana Roo, Mexico","Cozumel, Mexico",http://www.bluenotescuba.com
Sunset House,"Sunset House Hotel, Po Box 479 Gt, No State, Cayman Islands","Grand Cayman, Cayman Islands",http://www.sunsethouse.com
Big Blue Divers Platte Island,"Big Blue Divers Platte Island, Waldorf Astoria Resort, Platte Island, No State, Seychelles","Platte Island, Seychelles",http://www.diveinseychelles.com/platteisland
Dive Friends Bonaire @ Delfins,"44 Punt Vierkant, Kralendijk, Caribisch Nederland, Bonaire, Sint Eustatius, And Saba","Caribisch Nederland, Sint Eustatius",https://www.divefriendsbonaire.com
"Kona Honu Divers, Inc.","74-5583 Luhia St A12, Kailua-Kona, Hawaii, Hawaii 96740, United States","Kailua-Kona, Hawaii, United States of America (USA)",http://www.konahonudivers.com
Easy Divers - Bali,"Pemuteran, Gerokgak, Singaraja, Bali, Pemuteran, No State 81155, Indonesia","Pemuteran, Indonesia",http://www.easy-divers.eu
Under Pressure Diving,"Birkenstraße 1, 90587 Siegelsdorf, Germany","Siegelsdorf, Germany",https://under-pressure-diving.com
Under Pressure Diving,"Birkenstraße 1, 90587 Siegelsdorf, Germany","Siegelsdorf, Germany",https://under-pressure-diving.com
Guru Dive,"Marmara Mah. West Istanbul Marina, Bati Mendirek, Beylikdüzü, Istanbul/No State, Turkey","Istanbul, Turkey",http://www.gurudive.com
Taba Diving Centre Limited,"Perneras 20, Protaras, 5296 Paralimni, Protaras, Cyprus","Paralimni, Protaras, Cyprus",http://www.tabadiving.com
YBD Dive Centre,"Lot 60027, Palau Perhentian Kec, Pulau Perhentian, Kuala Besut, Terengganu, No State, Malaysia","Kuala Besut, Terengganu, Malaysia",http://www.ybddivecentre.com
All 4 Diving Indonesia,"Jalan Danau Tamblingan no. 168, Sanur, Bali, No State 80228, Indonesia","Bali, Indonesia",https://www.all4divingindonesia.com
Key Dives,"85960 Overseas Highway, Islamorada, Florida 33036, United States","Islamorada, United States of America (USA)",http://www.keydives.com
Key Dives,"85960 Overseas Highway, Islamorada, Florida 33036, United States","Islamorada, United States of America (USA)",http://www.keydives.com
Key Dives,"85960 Overseas Highway, Islamorada, Florida 33036, United States","Islamorada, United States of America (USA)",http://www.keydives.com
Islamorada Dive Center,"84001 Overseas Highway, Islamorada, Florida 33036, United States","Islamorada, United States of America (USA)",http://www.islamoradadivecenter.com
Islamorada Dive Center,"84001 Overseas Highway, Islamorada, Florida 33036, United States","Islamorada, United States of America (USA)",http://www.islamoradadivecenter.com
Bangkok SCUBA Academy,"231,233 Chamniansuk 3, Petchkasem Road, Wattapra Bangkokyai, Bangkok, No State 10600, Thailand","Bangkok, Thailand",https://www.facebook.com/BangkokSCUBAAcademy
Boutique Beach,"Boutique Beach Club, Aligiri, Dhigurah, South Ari Atoll 00070, Maldives","South Ari Atoll, Maldives",http://www.boutiquebeach.club
Boutique Beach,"Boutique Beach Club, Aligiri, Dhigurah, South Ari Atoll 00070, Maldives","South Ari Atoll, Maldives",http://www.boutiquebeach.club
Jan Thiel Diving,"Livingstone Jan Thiel Resort, Jan Thiel Oost Z/N, Willemstad, Curacao","Willemstad, Curaçao",http://www.janthieldiving.com
Scuba Junkie Kota Kinabalu,"G23 (Ground Floor) Wisma Sabah, Sabah, 88000 Kota Kinabalu, No State, Malaysia","Kota Kinabalu, Malaysia",https://www.scubajunkiekk.com/
No Deco Diving School,"Via Lugagnano snc, c/Marina Militare, 37139 Verona No State, Italy","Verona, Italy",http://www.nodecodiving.com
Ankay Conservation SA,"Lote 112, La Vida Solarte, Isla Solarte, Bocas Del Toro, No State, Panama (rep.)","Bocas Del Toro, Panama",https://www.ankayconservation.com
Ankay Conservation SA,"Lote 112, La Vida Solarte, Isla Solarte, Bocas Del Toro, No State, Panama (rep.)","Bocas Del Toro, Panama",https://www.ankayconservation.com
Panorama Diver,"Long Beach, Pulau Perhentian, Kuala Besut Terengganu, 22300 Perhentian, No State, Malaysia","Perhentian, Malaysia",http://panoramadiverperhentian.com/
Panorama Diver,"Long Beach, Pulau Perhentian, Kuala Besut Terengganu, 22300 Perhentian, No State, Malaysia","Perhentian, Malaysia",http://panoramadiverperhentian.com/
Boathouse Dive Centre & Spa,"Tioman Jungle Retreat Sdn. Bhd, Lot 7108, Kg. Nipah Pulau Tioman, 26800 Kuala Rompin, Pahang, No State, Malaysia","Kuala Rompin, Pahang, Malaysia",https://boathouse-tioman.com/
"Philippine Fun Divers, Inc","Alona Beach Road, Tawala, , Panglao, Bohol, 6340 No State, Philippines","Panglao, Bohol, Philippines",http://www.boholfundivers.com
"Philippine Fun Divers, Inc","Alona Beach Road, Tawala, , Panglao, Bohol, 6340 No State, Philippines","Panglao, Bohol, Philippines",http://www.boholfundivers.com
Dive Studio,"FOK 'Torpedo' Avtozavodskaya Str 21, Moscow, No State, Russian Federation","Moscow, Russia",http://www.divestudio.ru
Dive Studio,"FOK 'Torpedo' Avtozavodskaya Str 21, Moscow, No State, Russian Federation","Moscow, Russia",http://www.divestudio.ru
Big Apple Dive Resort,"Zone 3, Sabang, Puerto Galera, , Oriental Mindoro, 5203 No State, Philippines","Oriental Mindoro, Philippines",https://bigapplediveresort.com/
Big Apple Dive Resort,"Zone 3, Sabang, Puerto Galera, , Oriental Mindoro, 5203 No State, Philippines","Oriental Mindoro, Philippines",https://bigapplediveresort.com/
Reef Oasis Diving Center,"Al Dana Island, Villa 244, No State, United Arab Emirates","Fujairah, United Arab Emirates",http://www.reefoasisdivingcenter.com
Reef Oasis Diving Center,"Al Dana Island, Villa 244, No State, United Arab Emirates","Fujairah, United Arab Emirates",http://www.reefoasisdivingcenter.com
Tokoriki Diving,"Tokoriki Island Resort, Tokoriki Island, Fiji","Tokoriki Island, Fiji",http://www.tokorikidiving.com
Tokoriki Diving,"Tokoriki Island Resort, Tokoriki Island, Fiji","Tokoriki Island, Fiji",http://www.tokorikidiving.com
Go Aquatic,"Lot G30, Ground Floor, Wisma Sabah, Jalan Tun Razak, Sabah, 88000 Kota Kinabalu, No State, Malaysia","Kota Kinabalu, Malaysia",https://www.dive-goaquatic.com/
Aquasub Buceo,"Avenida Suba # 124 - 20 Interior 14, Centro Comercial Bahia, Bogota, No State,, Colombia","Bogota, Colombia",http://www.aquasubbuceo.com
Aquasub Buceo,"Avenida Suba # 124 - 20 Interior 14, Centro Comercial Bahia, Bogota, No State,, Colombia","Bogota, Colombia",http://www.aquasubbuceo.com
Lumba Lumba Diving Centre & Beach Resort,"Gapang Beach, Pulau Weh, Sumatra, Pulau Weh, No State 23518, Indonesia","Pulau Weh, Indonesia",https://lumbalumba.com/
One Ocean Zanzibar,"Stone Town, Zanzibar, Tanzania (united Rep.)","Zanzibar, Tanzania",http://www.zanzibaroneocean.com
One Ocean Zanzibar,"Stone Town, Zanzibar, Tanzania (united Rep.)","Zanzibar, Tanzania",http://www.zanzibaroneocean.com
"Hilo Ocean Adventures, LLC","1717 Kamehameha Avenue, Hilo, Hawaii, Hawaii 96720, United States","Hilo, Hawaii, United States of America (USA)",http://www.hilooceanadventures.com
"Hilo Ocean Adventures, LLC","1717 Kamehameha Avenue, Hilo, Hawaii, Hawaii 96720, United States","Hilo, Hawaii, United States of America (USA)",http://www.hilooceanadventures.com
Bali Dive Resort and Spa,"Jalan Raya Amlapura-Singaraja, Banjar Batudawa Kel, Desa Tulamben, Kecamatan Kubu, Karangasem Bali, Tulamben, No State 80853, Indonesia","Tulamben, Indonesia",https://www.balidiveresortandspa.com/padi-courses/
Bali Dive Resort and Spa,"Jalan Raya Amlapura-Singaraja, Banjar Batudawa Kel, Desa Tulamben, Kecamatan Kubu, Karangasem Bali, Tulamben, No State 80853, Indonesia","Tulamben, Indonesia",https://www.balidiveresortandspa.com/padi-courses/
Son Bou Scuba,"Centro Comercial San Jaime 4, Urb. Son Bou (Alaior), 07730 Son Bou, Menorca No State, Spain","Son Bou, Menorca, Spain",http://www.sonbouscuba.com
Musandam Discovery Diving,"Khasab, 811, Musandam, Oman","Musandam, Oman",http://www.musandam-discovery-diving.com
Bali Dive Resort Amed,,"Bali, Indonesia",
Scuba Iguana,"Avenida Charles Darwin, Puerto Ayora, Isla Santa Cruz, Galapagos, Ecuador","Galapagos, Ecuador",http://www.scubaiguana.com
Underwater Explorers,"Campismo do Ponta do Ouro, via Matutuine, Ponta do OuroNo State, Mozambique","Ponta do Ouro, Mozambique",http://www.underwaterexplorer.co.za
Go Aquatic Semporna,"YS Mariculture Adventure, Jalan Labuan Senang, Kampung Labuan, Senang, 91308 Semporna, No State, Malaysia","Semporna, Malaysia",http://www.dive-goaquatic.com
Sun Divers Roatan,"Half Moon Bay, West End, Roatan, Bay Islands, No State, 34101, Honduras","Roatan, Bay Islands, Honduras",http://sundiversroatan.com
Sea Sky Jeju,"No State Jeju-do, 20, Dodu 3 gil, jeju-si, 63112, South Korea","Jeju-do, South Korea",https://blog.naver.com/seaskyjeju
Mister Jump,"Piazza Vito Longo, 4, 90051 Ustica (PA) No State, Italy","Ustica (PA), Italy",http://www.misterjump.it
Caribbean Pro Dive Center,"Cra 2 Calle 18 esquina, Santa Marta, No State,, Colombia","Santa Marta, Colombia",http://www.caribbeanprodive.com
Red Sea Diving Safari - Wadi Lahami Village,"120km South Of Marsa Alam, Marsa Alam, No State, Egypt","Marsa Alam, Egypt",https://www.redsea-divingsafari.com/villages/wadi-lahami/accommodation
Easy Divers Rhodes,"Charaki, 85102 Rhodes, Greece","Rhodes, Greece",https://easydivers.gr/
Dive Maui,"1223 Front Street, Lahaina, Maui, Hawaii 96761, United States","Lahaina, Maui, United States of America (USA)",http://www.goscubadivemaui.com
Dive Rarotonga,"Yellow A-frame next to Crown Beach Resort, Main Road, Arorangi, Rarotonga, Cook Islands","Rarotonga, Cook Islands",http://www.diverarotonga.com
Dive Missoula,"500 North Higgins Avenue Suite 103, Missoula, Montana 59802, United States","Missoula, United States of America (USA)",http://www.divemissoula.com
Diving Center Sozopol,"Parvi May 21, 8130 Sozopol, Bulgaria (rep.)","Sozopol, Bulgaria",http://www.dive-sozopol.com
Fundiving Curacao,"Papagayo Beach Hotel, Kaya Artiko 1, Jan Thiel Beach, Willemstad, Curacao","Willemstad, Curaçao",https://fundivingcuracao.com
Pilardive,"Calle Araguaney, Numero 32, Urb La Arboleda, Maracay, Edo Aragua 2101, No State, Venezuela","Edo Aragua, Venezuela",https://www.instagram.com/pilardivemcy/?hl=es-la
Diving Montenegro,"Slovenska Obala bb, 85310 Budva, Montenegro","Budva, Montenegro",http://www.divingmontenegro.me
Marine Conservation Philippines,"MCP, Siit Arboretum, Lutoban Village, Zamboanguit, aNegros Oriental, , Dumaguete, 6218 No State, Philippines","Dumaguete, Philippines",https://marineconservationphilippines.org
Badladz Dive Resort,"Small Tabinay, Oriental Mindoro, , Puerto Galera, 5203 No State, Philippines","Puerto Galera, Philippines",https://www.badladz.com/badladz-scuba-diving/
Majellan Khorfakkan Diving,"Corniche St, Al Sharq Area, Khorfakkan, No State, United Arab Emirates","Sharjah, United Arab Emirates",https://khorfakkan-diving.com
Fuerteventura Buceo,"Avenida Saladar SN, C.C. Cosmo Local 49, 35626 Morro Jable, Las Palmas No State, Spain","Morro Jable, Las Palmas, Spain",http://fuerteventurabuceo.com
Dive Butler Amilla,"Amilla Fushi, Baa 7500, Maldives","Baa, Maldives",http://www.divebutlerinternational.com
